<?xml version="1.0" encoding="UTF-8"?>
<xs:schema xmlns:xs="http://www.w3.org/2001/XMLSchema">
    <xs:element name="curso">
        <xs:complexType>
            <xs:sequence>
                <xs:element name="nombre" type="xs:string" />
                <xs:element name="numero_aula" type="xs:string" />
                <xs:element name="horario">
                    <xs:complexType>
                        <xs:sequence>
                            <xs:element name="dias">
                                <xs:complexType>
                                    <xs:sequence>
                                        <xs:element name="dia" maxOccurs="unbounded">
                                            <xs:complexType>
                                                <xs:sequence>
                                                    <xs:element name="modulos">
                                                        <xs:complexType>
                                                            <xs:sequence>
                                                                <xs:element name="modulo"
                                                                    maxOccurs="unbounded">
                                                                    <xs:complexType>
                                                                        <xs:simpleContent>
                                                                            <xs:extension
                                                                                base="xs:string">
                                                                                <xs:attribute
                                                                                    name="hora_inicio"
                                                                                    use="required" />
                                                                                <xs:attribute
                                                                                    name="hora_fin"
                                                                                    use="required" />
                                                                            </xs:extension>
                                                                        </xs:simpleContent>
                                                                    </xs:complexType>
                                                                </xs:element>
                                                            </xs:sequence>
                                                        </xs:complexType>
                                                    </xs:element>
                                                </xs:sequence>
                                                <xs:attribute name="nombre" use="required" />
                                            </xs:complexType>
                                        </xs:element>
                                    </xs:sequence>
                                </xs:complexType>
                            </xs:element>
                        </xs:sequence>
                    </xs:complexType>
                </xs:element>
                <xs:element name="equipos_informaticos">
                    <xs:complexType>
                        <xs:sequence>
                            <xs:element name="equipo" maxOccurs="unbounded">
                                <xs:complexType>
                                    <xs:sequence>
                                        <xs:element name="ip" type="xs:string" />
                                        <xs:element name="mascara" type="xs:string" />
                                        <xs:element name="puerta_enlace" type="xs:string" />
                                    </xs:sequence>
                                    <xs:attribute name="numero" use="required" />
                                </xs:complexType>
                            </xs:element>
                        </xs:sequence>
                    </xs:complexType>
                </xs:element>
                <xs:element name="alumnos">
                    <xs:complexType>
                        <xs:sequence>
                            <xs:element name="alumno" maxOccurs="unbounded">
                                <xs:complexType>
                                    <xs:sequence>
                                        <xs:element name="pc">
                                            <xs:complexType>
                                                <xs:attribute name="numero" use="required" />
                                            </xs:complexType>
                                        </xs:element>
                                    </xs:sequence>
                                    <xs:attribute name="nombre" use="required" />
                                </xs:complexType>
                            </xs:element>
                        </xs:sequence>
                    </xs:complexType>
                </xs:element>
            </xs:sequence>
        </xs:complexType>
    </xs:element>
</xs:schema>